1,"The conviction marked the end of a long legal battle."
1,"The judge delivered the conviction with solemnity."
1,"His conviction was a catalyst for criminal justice reform discussions."
1,"Reversing a conviction requires substantial new evidence."
1,"The conviction brought closure to the victim's family."
1,"He faced a minimum sentence due to a prior conviction."
1,"The jury's swift conviction surprised many observers."
1,"The high-profile case led to a controversial conviction."
1,"A conviction doesnt always signify absolute guilt."
1,"The conviction was based on circumstantial evidence."
1,"Her conviction was a pivotal moment in the courtroom drama."
1,"An overturned conviction doesn't erase the trauma of incarceration."
1,"The conviction was a turning point in his life."
1,"Public outcry followed the controversial conviction."
1,"A plea bargain often results in a reduced conviction."
1,"His conviction haunted him even after serving his sentence."
1,"The evidence presented led to a swift conviction."
1,"The conviction had a ripple effect on similar cases."
1,"The lack of a confession complicated the conviction process."
1,"The conviction highlighted the need for forensic advancements."
1,"Despite the conviction, questions about the accused's motive persisted."
1,"An unjust conviction can erode trust in the legal system."
1,"The wrongful conviction sparked public outrage."
1,"The conviction brought relief to the community."
1,"A conviction can have far-reaching consequences beyond the individual."
1,"The appeal aimed to overturn the unjust conviction."
1,"The conviction showcased flaws in witness testimony."
1,"Conviction rates vary significantly across different jurisdictions."
1,"The conviction relied heavily on expert testimony."
1,"The conviction was a result of a plea deal."
1,"The conviction underscored the importance of jury selection."
1,"The conviction marked the end of a lengthy trial."
1,"The wrongful conviction exposed systemic issues in law enforcement."
1,"The conviction was based on the defendant's confession."
1,"The conviction raised ethical questions about the use of evidence."
1,"The conviction stirred debates about the death penalty."
1,"A prior conviction can impact the severity of sentencing."
1,"The conviction was a blow to the defendant's reputation."
1,"His conviction prompted discussions on mental health in prisons."
1,"The conviction was a victory for the prosecution."
1,"The conviction was based on a unanimous jury decision."
1,"The overturned conviction brought a sense of vindication."
1,"A flawed conviction can lead to wrongful imprisonment."
1,"The conviction was a result of tireless investigative work."
1,"The conviction highlighted biases within the judicial system."
1,"The conviction resulted from a plea of no contest."
1,"The conviction was a defining moment in legal history."
1,"The conviction underscored the importance of due process."
1,"A prior conviction can influence bail decisions."
1,"The conviction set a precedent for similar cases."
1,"The wrongful conviction led to compensation for the accused."
1,"The conviction was based on eyewitness testimony."
1,"The conviction sparked conversations about sentencing reform."
1,"The conviction weighed heavily on the jury's conscience."
1,"The overturned conviction shed light on flawed evidence."
1,"The conviction was seen as a victory for victims' rights."
1,"The conviction was a culmination of diligent prosecution."
1,"The conviction was met with skepticism by legal experts."
1,"The conviction was a result of plea bargaining."
1,"The wrongful conviction was a miscarriage of justice."
1,"The conviction raised doubts about the credibility of witnesses."
1,"The conviction was based on digital forensic evidence."
1,"The conviction was a testament to the perseverance of law enforcement."
1,"The conviction highlighted the need for judicial reform."
1,"The overturned conviction brought a sense of closure."
1,"The conviction was a blow to the defendant's defense strategy."
1,"The conviction was based on a preponderance of evidence."
1,"The conviction was the culmination of a thorough investigation."
1,"The wrongful conviction led to a review of the case."
1,"The conviction was secured despite a lack of physical evidence."
1,"The conviction was a result of a plea bargain agreement."
1,"The conviction was a victory for victims' families."
1,"The overturned conviction shed light on flawed legal procedures."
1,"The conviction brought solace to the aggrieved party."
1,"The conviction highlighted flaws in eyewitness identification."
1,"The conviction sparked debates on mandatory minimum sentencing."
1,"The conviction relied on the testimony of an expert witness."
1,"The wrongful conviction spurred efforts for exoneration."
1,"The conviction weighed heavily on the conscience of the jurors."
1,"The conviction marked a milestone in the legal battle."
1,"The conviction prompted discussions on judicial bias."
1,"The conviction was based on substantial forensic evidence."
1,"The overturned conviction revealed hidden injustices."
1,"The conviction was a result of a unanimous verdict."
1,"The wrongful conviction raised questions about legal ethics."
1,"The conviction underscored the importance of preserving evidence."
1,"The conviction was a product of a contentious trial."
1,"The overturned conviction brought relief to the accused."
1,"The conviction was the outcome of a contentious courtroom battle."
1,"The conviction was pivotal in setting a legal precedent."
1,"The wrongful conviction highlighted flaws in witness testimonies."
1,"The conviction led to calls for a retrial."
1,"The conviction had a profound impact on legal procedures."
1,"The overturned conviction sparked discussions on reforming the justice system."
1,"His conviction stemmed from irrefutable evidence presented during the trial."
1,"The conviction was met with mixed reactions from the public, some believing it unjust, others finding closure."
1,"The judge delivered the conviction, acknowledging the gravity of the crime committed."
1,"Despite the conviction, doubts lingered about the accuracy of the evidence presented."
1,"Her conviction resulted in a lengthy prison sentence, a consequence of the severity of the offense."
1,"The appeal aimed to overturn the wrongful conviction that had shattered his life."
1,"The conviction was a pivotal moment in the pursuit of justice for the victim's family."
1,"The defense team worked tirelessly to prevent the wrongful conviction of their client."
1,"The prosecution built a solid case that led to the defendant's conviction."
1,"His conviction marked the end of a lengthy legal battle that had garnered national attention."
1,"The conviction brought closure to a community that had been deeply affected by the crime."
1,"Despite the overwhelming evidence, his conviction felt unjust to many observers."
1,"The judge's words echoed through the courtroom as he announced the conviction."
1,"The conviction carried a weight that extended beyond the individual involved, impacting societal trust in the legal system."
1,"Her conviction prompted discussions about flaws within the judicial process."
1,"The conviction served as a deterrent, sending a clear message about the consequences of criminal behavior."
1,"His conviction was based on circumstantial evidence that raised concerns about the fairness of the trial."
1,"The wrongful conviction exposed flaws within the legal system, prompting calls for reform."
1,"The appeal sought to challenge the conviction on the grounds of new evidence."
1,"The conviction represented a significant milestone in the pursuit of justice."
1,"Despite efforts to secure a conviction, the jury remained deadlocked."
1,"His conviction brought relief to the victim's family, who had sought closure for years."
1,"The conviction was a result of meticulous investigative work by law enforcement."
1,"The defendant's remorse was palpable as the judge pronounced the conviction."
1,"The conviction highlighted the need for improvements in forensic techniques."
1,"Her conviction was a stark reminder of the consequences of one impulsive decision."
1,"The defense attorney presented compelling arguments to cast doubt on the validity of the conviction."
1,"The conviction resonated deeply within the legal community, sparking debates on sentencing guidelines."
1,"His conviction was a culmination of years of legal battles and appeals."
1,"Despite facing overwhelming odds, the defense team managed to secure an acquittal instead of a conviction."
1,"The conviction carried a sense of closure for those who had followed the case from its inception."
1,"The guilty plea minimized the trial proceedings, resulting in a swift conviction."
1,"The conviction stirred conversations about rehabilitation versus punitive measures."
1,"The appeal process aimed to rectify a wrongful conviction that had severe implications."
1,"The conviction served as a testament to the dedication of law enforcement and prosecutors."
1,"Despite the conviction, doubts persisted about the accuracy of witness testimonies."
1,"The conviction had a profound impact on the defendant's life, altering their future trajectory."
1,"The defense team aimed to highlight procedural errors that could lead to the overturning of the conviction."
1,"The conviction underscored the need for better safeguards to prevent wrongful accusations."
1,"His conviction marked a turning point in his life, prompting introspection and change."
1,"The public outcry following the conviction highlighted concerns about bias within the justice system."
1,"The conviction was met with a sense of closure for the victim's loved ones."
1,"Despite attempts to appeal, the conviction remained unchanged."
1,"The conviction's aftermath sparked discussions on rehabilitation programs within correctional facilities."
1,"His conviction raised questions about the effectiveness of rehabilitation versus punitive measures."
1,"The conviction brought relief to a community haunted by the unsolved crime for years."
1,"The conviction was a culmination of a thorough and exhaustive legal process."
1,"The defendant's confession led to a swift conviction and sentencing."
1,"Despite facing intense scrutiny, the conviction stood firm, validated by compelling evidence."
1,"The conviction was a result of a plea deal that reduced the severity of the sentence."
1,"His conviction led to introspection about the flaws in the legal system."
1,"The prosecution's compelling arguments resulted in a unanimous conviction from the jury."
1,"The wrongful conviction highlighted systemic issues in law enforcement practices."
1,"Her conviction evoked empathy, sparking discussions about societal influences on criminal behavior."
1,"The conviction carried the weight of public expectation for justice to prevail."
1,"Despite efforts to challenge it, the conviction remained steadfast."
1,"The conviction was a culmination of the tireless efforts of law enforcement and prosecutors."
1,"The defendant's history played a role in the severity of the conviction's sentencing."
1,"The conviction's fallout prompted reforms in witness protection programs."
1,"His conviction marked the beginning of a lengthy sentence in a maximum-security facility."
1,"The conviction was met with skepticism, with some believing it was politically motivated."
1,"Despite the guilty verdict, the conviction felt like a failure of the justice system to some."
1,"The conviction served as a cautionary tale, influencing public perceptions of certain behaviors."
1,"The conviction led to renewed discussions on the effectiveness of rehabilitation programs in prisons."
1,"Her conviction prompted soul-searching within the legal community about bias in sentencing."
1,"The appeal sought to uncover new evidence that could potentially overturn the conviction."
1,"The conviction's impact reverberated beyond the courtroom, shaping public discourse on criminal justice."
1,"Despite the overwhelming evidence, the conviction raised concerns about procedural errors."
1,"The conviction served as a somber reminder of the consequences of criminal actions."
1,"The jury's unanimous decision sealed the defendant's conviction."
1,"His conviction brought closure to a case that had puzzled investigators for years."
1,"The conviction carried implications for future legal precedents in similar cases."
1,"The conviction's aftermath led to reforms in the handling of forensic evidence."
1,"Despite objections from the defense, the conviction stood firm."
1,"The conviction's aftermath prompted a reevaluation of eyewitness testimony reliability."
1,"Her conviction highlighted societal inequalities within the justice system."
1,"The conviction's impact extended beyond the defendant, affecting their family deeply."
1,"The guilty plea expedited the trial process, resulting in a swift conviction."
1,"Despite the conviction, doubts persisted about the accuracy of key witness statements."
1,"The conviction underscored the importance of ensuring fair trials for all defendants."
1,"The appeal aimed to highlight flaws in the evidence that led to the conviction."
1,"The conviction's repercussions extended far beyond the individual involved."
1,"Despite the overwhelming evidence, the conviction stirred debates about its fairness."
1,"The conviction's aftermath prompted initiatives to support ex-convicts reintegrating into society."
1,"The conviction served as a benchmark for future cases of a similar nature."
1,"Her conviction led to introspection about societal factors contributing to criminal behavior."
1,"The conviction marked the end of a legal battle that had consumed resources and time."
1,"Despite the conviction, questions lingered about the adequacy of legal representation."
1,"The conviction's fallout prompted discussions about the impact of socioeconomic status on legal outcomes."
1,"The guilty plea minimized the trial's duration, leading to a swift conviction."
1,"The conviction resonated within the community, signaling a shift in perceptions about crime."
1,"His conviction triggered a review of sentencing guidelines for similar offenses."
1,"Despite the conviction, efforts to find mitigating circumstances continued."
1,"The conviction's aftermath prompted soul-searching within the judicial system."
1,"The conviction's impact on the victim's family was palpable, bringing a sense of closure."
1,"The conviction's severity raised questions about the adequacy of rehabilitation programs."
1,"Her conviction prompted discussions about the root causes of criminal behavior."
1,"Despite mounting evidence, the conviction faced challenges due to procedural irregularities."
1,"The conviction's aftermath prompted reforms aimed at reducing recidivism rates."
1,"His conviction highlighted the complexities and ethical dilemmas within the legal system."
1,"His conviction for embezzlement resulted in a lengthy prison sentence."
1,"The judge's stern demeanor signaled an impending conviction in the courtroom."
1,"Despite mounting evidence, his conviction remained steadfast, proclaiming innocence."
1,"The jury's swift conviction surprised many observers given the complexity of the case."
1,"The conviction was a culmination of meticulous investigation and compelling evidence."
1,"The prosecutor sought a harsher sentence to match the gravity of the conviction."
1,"The appeal process aimed to overturn the wrongful conviction."
1,"Her conviction brought closure to a long-standing case, bringing relief to the victim's family."
1,"The defense lawyer's strategy aimed to cast doubt on the prosecution's key convictions."
1,"Public outcry demanded a retrial, questioning the legitimacy of the conviction."
1,"The judge's verdict reflected the severity of the conviction, imposing maximum penalties."
1,"The conviction reverberated through the legal community, setting a precedent."
1,"A wrongful conviction haunted him, despite subsequent acquittals."
1,"The conviction relied on circumstantial evidence, sparking debates on legal loopholes."
1,"His demeanor during the trial swayed the jury towards a guilty conviction."
1,"The conviction carried a sense of finality, altering the course of many lives."
1,"The case's complexity made the conviction a contentious issue among legal experts."
1,"The conviction prompted introspection on flaws within the judicial system."
1,"Despite overwhelming evidence, doubts lingered about the validity of the conviction."
1,"The conviction's impact extended beyond the courtroom, shaping public opinion."
1,"An appeal was filed, contesting the validity of the conviction on procedural grounds."
1,"The conviction highlighted the importance of forensic evidence in securing verdicts."
1,"The judge's statement before the sentencing conveyed the gravity of the conviction."
1,"The prosecution's meticulous preparation solidified the conviction."
1,"Post-conviction hearings aimed to rectify potential errors during the trial."
1,"The conviction brought closure to a long-drawn legal battle."
1,"Despite protests, the conviction stood firm, prompting calls for justice reform."
1,"The conviction's fallout sparked discussions on the rehabilitation of offenders."
1,"His conviction shattered his once-promising career, leaving a lasting impact."
1,"The conviction's fallout extended beyond legal repercussions, affecting societal trust."
1,"Doubts about witness credibility cast a shadow on the conviction's validity."
1,"The judge's impartiality during the trial ensured a fair and just conviction."
1,"Post-conviction evidence shed new light on the case, leading to a retrial."
1,"The severity of the conviction prompted discussions on sentencing guidelines."
1,"The conviction's aftermath led to renewed efforts in criminal justice reform."
1,"A series of appeals aimed to overturn the controversial conviction."
1,"The conviction served as a cautionary tale for those in similar circumstances."
1,"His remorse during sentencing lessened the impact of the conviction."
1,"The conviction's implications extended beyond the individual to societal norms."
1,"The jury's unanimous decision cemented the conviction beyond doubt."
1,"The conviction's impact reverberated through the victim's family and community."
1,"The defense's argument aimed to poke holes in the prosecution's key convictions."
1,"The media frenzy surrounding the trial overshadowed the essence of the conviction."
1,"The conviction spurred advocacy for the wrongfully accused."
1,"The conviction's repercussions on his personal and professional life were profound."
1,"Legal experts debated the legal precedents set by the controversial conviction."
1,"Despite the conviction, doubts lingered about the accused's actual involvement."
1,"Post-conviction investigations aimed to unearth new evidence for exoneration."
1,"The conviction's aftermath led to introspection within the legal fraternity."
1,"A retrial was granted due to new evidence casting doubt on the initial conviction."
1,"The conviction marked a turning point in the pursuit of justice for the victim."
1,"Despite initial doubts, the conviction rested on solid forensic evidence."
1,"Post-conviction counseling aimed to facilitate reintegration into society."
1,"The high-profile nature of the case added pressure to secure a swift conviction."
1,"The conviction's repercussions extended beyond the defendant to their family."
1,"The prosecutor's closing argument solidified the jury's conviction."
1,"Doubts about the evidence plagued the legitimacy of the conviction."
1,"Post-conviction efforts focused on rehabilitation rather than punitive measures."
1,"The conviction underscored the need for judicial transparency."
1,"The defense's appeal highlighted procedural errors in the initial conviction."
1,"The conviction's impact on public perception influenced subsequent trials."
1,"The accused's demeanor during the trial swayed the jury towards conviction."
1,"Despite protests, the conviction was upheld, sparking debates on judicial fairness."
1,"Post-conviction initiatives aimed to prevent wrongful convictions in the future."
1,"The conviction's aftermath prompted a review of sentencing guidelines."
1,"Doubts about witness reliability clouded the validity of the conviction."
1,"The conviction's aftermath spurred reforms in the legal system."
1,"The conviction's validity was questioned due to newly discovered evidence."
1,"The conviction served as a deterrent for similar criminal acts."
1,"The judge's sentencing reflected the severity of the conviction."
1,"Post-conviction efforts sought to rectify systemic flaws in the justice system."
1,"The conviction's fallout extended to public discourse on legal ethics."
1,"Doubts about the defendant's mental state raised questions about the conviction."
1,"The conviction's impact resonated through legislative discussions on criminal law."
1,"The appeal process aimed to overturn the controversial conviction."
1,"The conviction's consequences were felt far beyond the confines of the courtroom."
1,"Post-conviction measures focused on supporting victims and their families."
1,"The conviction prompted soul-searching within the legal community."
1,"The prosecution's case left no room for doubt regarding the conviction."
1,"Doubts about the accused's alibi complicated the certainty of the conviction."
1,"The conviction served as a benchmark for similar cases in the future."
1,"Post-conviction resources aided in the defendant's reintegration into society."
1,"The conviction's impact on public trust in the legal system was profound."
1,"The defendant's remorse during sentencing impacted the severity of the conviction."
1,"Doubts about the chain of evidence cast a shadow on the conviction's legitimacy."
1,"The conviction's implications extended to broader discussions on rehabilitation."
1,"Post-conviction investigations unearthed new evidence, prompting a retrial."
1,"The conviction's consequences led to introspection within law enforcement."
1,"The defense's argument aimed to challenge the prosecution's key convictions."
1,"Doubts about the reliability of expert testimony questioned the conviction."
1,"The conviction's fallout prompted reassessment of the judicial process."
1,"Post-conviction support programs aimed to assist former inmates in rebuilding their lives."
1,"The conviction's impact on sentencing guidelines sparked legislative review."
1,"The defendant's demeanor during the trial influenced the jury's conviction."
1,"Doubts about the chain of custody raised concerns about the conviction's integrity."
1,"The conviction's aftermath prompted a nationwide debate on legal reform."
1,"Post-conviction advocacy groups aimed to prevent miscarriages of justice."
1,"The conviction's implications reached beyond the defendant to societal norms."
1,"Doubts about the timeline of events cast uncertainty on the conviction."
1,"The conviction's reverberations prompted calls for a reassessment of the case."
0,"Despite the lack of evidence, the prosecutor was able to build a case based on his conviction in the witness' testimony."
0,"The company's CEO had a conviction that their product would be successful and invested heavily in its development."
0,"The scientist had a conviction about the importance of her research and worked tirelessly to prove it."
0,"The athlete had a conviction that he could win the race and trained every day with that belief in mind."
0,"The activist had a conviction that change was possible and dedicated his life to fighting for it."
0,"The politician had a conviction about the importance of his policies and worked hard to convince others of their merit."
0,"The artist had a conviction about her vision and refused to compromise on her creative goals."
0,"The musician had a conviction that he could create something truly great and poured all of himself into his music."
0,"The scientist had a conviction that the universe was full of mysteries waiting to be discovered."
0,"The explorer had a conviction that there were still undiscovered lands out there waiting to be explored."
0,"The inventor had a conviction that he could create something truly revolutionary and worked tirelessly to bring his ideas to life."
0,"The entrepreneur had a conviction that she could build a successful business and poured all of herself into making it happen."
0,"The student had a conviction about the importance of education and worked hard to achieve her goals."
0,"The teacher had a conviction that every student has the potential to succeed and worked tirelessly to help them realize their dreams."
0,"The athlete had a conviction that he could break the record and trained every day with that belief in mind."
0,"The artist had a conviction about her vision and refused to compromise on her creative goals."
0,"The musician had a conviction that he could create something truly great and poured all of himself into his music."
0,"The scientist had a conviction that the universe was full of mysteries waiting to be discovered."
0,"The explorer had a conviction that there were still undiscovered lands out there waiting to be explored."
0,"The inventor had a conviction that he could create something truly revolutionary and worked tirelessly to bring his ideas to life."
0,"entrepreneur had a conviction that she could build a successful business and poured all of herself into making it happen."
0,"The student had a conviction about the importance of education and worked hard to achieve her goals."
0,"The teacher had a conviction that every student has the potential to succeed and worked tirelessly to help them realize their dreams."
0,"The athlete had a conviction that he could break the record and trained every day with that belief in mind."
0,"The musician had a conviction that he could create something truly great and poured all of himself into his music."
0,"The scientist had a conviction that the universe was full of mysteries waiting to be discovered."
