1,"The prosecution's case relied heavily on eyewitness testimony for the conviction."
1,"The guilty plea resulted in a faster conviction and a reduced sentence."
1,"The conviction marked a significant milestone in the pursuit of justice for the victim."
1,"The defendant's attempt to flee the country heightened suspicion and contributed to the conviction."
1,"The convicted individual's attempt to tamper with evidence added weight to the prosecution's case for conviction."
1,"The conviction was the culmination of tireless efforts by law enforcement."
1,"The judge's instructions to the jury emphasized the importance of unbiased deliberation in reaching a fair conviction."
1,"The convicted individual's age and mental state were considered during sentencing post-conviction."
1,"The defense's alibi significantly undermined the prosecution's attempt at securing a conviction."
1,"The conviction resonated deeply within the community, sparking debates on the efficacy of the legal system."
1,"The conviction was based on a confession that later proved to be coerced."
1,"The defense team's procedural errors weakened their stance against the conviction."
1,"The court's strict adherence to legal protocols ensured a fair process leading to conviction."
1,"The conviction was a testament to the persistence of law enforcement in pursuing justice."
1,"The lack of physical evidence made it challenging to secure a conviction."
1,"The defense attorney's closing argument aimed to plant seeds of doubt to avoid conviction."
1,"The conviction's impact extended beyond the courtroom, affecting the lives of those involved."
1,"The conviction brought solace to the victim's family, providing a sense of closure."
1,"The jury's unanimous decision showcased the strength of the evidence supporting the conviction."
1,"The severity of the conviction reflected the heinous nature of the crime."
1,"The convicted individual's lack of remorse influenced the sentencing post-conviction."
1,"The defense's counterarguments aimed to dismantle the prosecution's case for conviction."
1,"The conviction triggered a review of similar cases to prevent potential miscarriages of justice."
1,"The convicted individual's plea for leniency after the conviction fell on deaf ears."
1,"The media frenzy surrounding the case significantly influenced the eventual conviction."
1,"The lack of a credible alibi weakened the defense's stance against the conviction."
1,"The conviction was based on a combination of eyewitness accounts and forensic evidence."
1,"The defense attorney's closing statement resonated with the jury, casting doubt on the conviction."
1,"The severity of the conviction warranted an appeal process."
1,"The defense's tactic of discrediting witnesses aimed to cast doubt on the impending conviction."
1,"The conviction stirred controversy, prompting discussions on flaws within the legal system."
1,"The convicted individual's demeanor during the trial influenced the jury's perception of the conviction."
1,"The prosecution's compelling narrative contributed to a swift conviction."
1,"The absence of a credible motive complicated the path to securing a conviction."
1,"The convicted individual's attempt to establish an alibi was undermined by contradictory evidence."
1,"The conviction was a result of a plea bargain between the defense and prosecution."
1,"The defense's expert witness played a pivotal role in challenging the prosecution's case for conviction."
1,"The conviction prompted a reevaluation of certain aspects of the legal system."
1,"The convicted individual's previous run-ins with the law influenced the severity of the post-conviction sentencing."
1,"The lack of direct evidence made it challenging to secure a conviction."
1,"The conviction relied heavily on circumstantial evidence, sparking debates about its reliability."
1,"The jury's careful consideration of the evidence led to a just conviction."
1,"The convicted individual's lack of remorse during sentencing impacted the severity of the punishment post-conviction."
1,"The defense's attempt to establish an alibi was shattered by solid evidence, leading to the conviction."
1,"The conviction raised questions about the effectiveness of witness testimony in court."
1,"The lack of physical evidence posed a challenge in securing a conviction."
1,"The prosecution's meticulous presentation of evidence was pivotal in securing the conviction."
1,"The convicted individual's defiance in court added weight to the conviction."
1,"The conviction stood as a testament to the dedication of law enforcement and legal teams."
1,"The lack of concrete evidence made it challenging to secure a conviction."
1,"The defense's strategy to undermine the credibility of witnesses aimed to prevent a conviction."
1,"The conviction was based on a combination of testimonies and forensic analysis."
1,"The lack of a clear motive complicated the path to securing a conviction."
1,"The conviction resonated within the legal community, sparking discussions on reforms."
1,"The convicted individual's attempts to manipulate evidence backfired, leading to a stronger conviction."
1,"The jury's deliberation reflected the seriousness with which they approached the conviction."
1,"The defense's efforts to discredit key evidence aimed to prevent a conviction."
1,"The lack of remorse displayed by the convicted individual impacted the post-conviction sentencing."
1,"The conviction highlighted the flaws in the justice system that contribute to wrongful imprisonments."
1,"The defense's reliance on character witnesses aimed to sway the jury away from a conviction."
1,"The prosecution's case was bolstered by concrete evidence, leading to a swift conviction."
1,"The convicted individual's cooperation with authorities influenced the post-conviction sentencing."
1,"The conviction served as a cautionary tale, emphasizing the need for fair trials and thorough investigations."
1,"The notorious murder case led to a swift conviction, closing a chapter of uncertainty for the victim's family."
1,"Analyzing historical cases of wrongful convictions highlights the need for updated forensic methodologies."
1,"The complex fraud case resulted in multiple convictions, revealing the intricate web of deceit."
1,"Studying landmark cases deepens one's understanding of legal precedent in securing convictions."
1,"Examining past convictions overturned by new evidence emphasizes the importance of ongoing investigations."
1,"Understanding the burden of proof is crucial for securing convictions in court."
1,"The nuances of circumstantial evidence often play a pivotal role in securing convictions."
1,"The concept of 'beyond a reasonable doubt' remains central to criminal convictions."
1,"Legal loopholes sometimes hinder convictions, leading to contentious outcomes."
1,"Learning the intricacies of jury selection can significantly impact trial convictions."
1,"Heated debates about high-profile convictions often involve moral and ethical considerations."
1,"Analyzing differing viewpoints on controversial convictions reveals societal divides."
1,"The emotional impact of convictions on families sparks ethical debates in legal circles."
1,"Psychological analyses of jurors' biases shed light on their influence on trial convictions."
1,"Analyzing public opinion shifts following high-profile convictions highlights societal attitudes."
1,"Studying cases of wrongful convictions elucidates flaws in investigative techniques."
1,"Understanding the psychology behind false confessions is crucial in preventing wrongful convictions."
1,"Case reviews post-conviction errors pave the way for legal reforms to minimize mistakes."
1,"Learning from historical miscarriages of justice helps prevent future wrongful convictions."
1,"Revisiting overturned convictions aids in understanding evolving legal standards."
1,"Playing the role of a defense attorney helps comprehend the challenges in preventing convictions."
1,"Assuming the prosecutor's role highlights the strategies essential for securing convictions."
1,"Simulating a judge's perspective in weighing evidence aids in understanding convictions."
1,"Engaging in mock trials deepens understanding of the criteria that lead to convictions."
1,"Role-playing a juror's decision-making process enhances comprehension of trial convictions."
1,"The court handed down a conviction for the theft, resulting in a five-year prison sentence."
1,"His conviction for fraud altered the course of his career forever."
1,"Despite his efforts, the evidence led to a conviction for the murder charge."
1,"The conviction brought closure to the long-standing case."
1,"Her conviction was met with a unanimous verdict from the jury."
1,"The prosecution's case was strong, leading to a swift conviction."
1,"His conviction meant he had to serve community service for a year."
1,"The judge pronounced the conviction, echoing through the silent courtroom."
1,"The conviction stood as a testament to the thoroughness of the investigation."
1,"Despite his pleas of innocence, the conviction was inevitable."
1,"The gravity of the crime warranted a severe conviction."
1,"The conviction haunted him, impacting every aspect of his life."
1,"His lawyer aimed to appeal the conviction on grounds of new evidence."
1,"The conviction shook the community, leaving them in disbelief."
1,"The weight of the conviction was evident in the defendant's demeanor."
1,"His conviction served as a warning to others contemplating similar actions."
1,"The trial resulted in a swift conviction, surprising many observers."
1,"The evidence presented left no doubt about the conviction."
1,"The appeal aimed to overturn the unjust conviction."
1,"The conviction carried a sentence of twenty years in prison."
1,"Despite the conviction, doubts lingered about the defendant's involvement."
1,"The conviction brought relief to the victim's family."
1,"The prosecution's case ensured a guilty conviction."
1,"His prior convictions influenced the severity of the sentence."
1,"The conviction highlighted the flaws in the legal system."
1,"The jury reached a unanimous decision for the conviction."
1,"The appeal process aimed to overturn the wrongful conviction."
1,"The conviction marked the end of a lengthy trial."
1,"His confession led to a swift conviction."
1,"The guilty plea resulted in a quicker conviction."
1,"The evidence was overwhelming, securing the conviction."
1,"The conviction shattered his hopes for an acquittal."
1,"The conviction carried a lifetime ban from certain professions."
1,"The conviction left a stain on his otherwise clean record."
1,"The defense attorney aimed to cast doubt on the conviction."
1,"The conviction served as a deterrent for future crimes."
1,"The conviction led to a mandatory rehabilitation program."
1,"The gravity of the crime demanded a severe conviction."
1,"The conviction brought a sense of closure to the investigation."
1,"The judge's words echoed the solemnity of the conviction."
1,"The conviction sparked a heated debate about the justice system."
1,"The conviction carried a hefty fine along with imprisonment."
1,"The overwhelming evidence sealed the conviction."
1,"The defendant's remorse did not mitigate the severity of the conviction."
1,"The jury's decision resulted in the conviction of all charges."
1,"The conviction underscored the need for legal reform."
1,"The conviction was the culmination of months of legal proceedings."
1,"The severity of the conviction sent shockwaves through the community."
1,"The defense attempted to poke holes in the prosecution's case to avoid the conviction."
1,"The conviction brought solace to the victim's grieving family."
1,"The conviction had repercussions beyond just the defendant's life."
1,"The guilty verdict led to the inevitable conviction."
1,"The conviction carried a mandatory rehabilitation program."
1,"The defense aimed to appeal the conviction on procedural errors."
1,"The conviction highlighted systemic flaws in the justice system."
1,"The conviction served as a stark reminder of the consequences of illegal actions."
1,"The appeal aimed to overturn the unjust conviction."
1,"The conviction left a lasting impact on his reputation."
1,"The severity of the conviction reflected the severity of the crime."
1,"The conviction led to a reevaluation of certain legal procedures."
1,"The evidence presented left no room for doubt about the conviction."
1,"The conviction served as a cautionary tale for others."
1,"The judge's words pronounced the finality of the conviction."
1,"The conviction warranted a sentence of community service."
1,"The conviction carried a mandatory counseling program."
1,"The defendant's demeanor during the trial affected the perception of the conviction."
1,"The conviction stirred discussions about the effectiveness of the legal system."
1,"The weight of the conviction was palpable in the courtroom."
1,"The conviction's impact rippled through the defendant's social circle."
1,"The severity of the conviction reflected the seriousness of the offense."
1,"The defense lawyer aimed to cast doubt on the conviction through witness testimonies."
1,"The conviction had a profound effect on the defendant's family."
1,"The conviction brought closure to a long and arduous legal battle."
1,"The conviction carried a sentence of probation along with community service."
1,"The prosecution's case ensured a guilty conviction."
1,"The conviction marked the end of a complex legal saga."
1,"The conviction led to a mandatory anger management program."
1,"The appeal process aimed to overturn the erroneous conviction."
1,"The conviction sent shockwaves through the legal community."
1,"The weight of the conviction was evident in the courtroom's atmosphere."
1,"The conviction served as a stark reminder of the consequences of criminal behavior."
1,"The conviction resulted in a lifetime ban from specific professions."
1,"The judge's pronouncement sealed the defendant's conviction."
1,"The conviction carried a substantial financial penalty."
1,"The conviction brought a sense of relief to the victim's family."
1,"The severity of the conviction resonated with the seriousness of the crime."
1,"The conviction prompted a review of similar cases."
1,"The evidence presented left no room for leniency in the conviction."
1,"The conviction served as a deterrent for potential offenders."
1,"The conviction's impact extended beyond the courtroom."
1,"The conviction was the culmination of a meticulously built case."
1,"The conviction prompted discussions about reforming sentencing laws."
1,"The weight of the conviction was evident in the defendant's demeanor."
1,"The conviction carried a mandatory restitution requirement."
1,"The conviction led to mandatory attendance in rehabilitation programs."
1,"The conviction left an indelible mark on his personal and professional life."
1,"The appeal aimed to challenge the validity of the conviction."
1,"The conviction was a testament to the thoroughness of the investigation."
1,"The severity of the conviction reflected the severity of the crime."
1,"The conviction brought closure to a case that had long perplexed law enforcement."
1,"The conviction was based on irrefutable evidence presented during the trial."
1,"His conviction for theft resulted in a five-year prison sentence."
1,"The court delivered a swift conviction, reflecting the gravity of the crime."
1,"Despite a thorough defense, the jury's conviction was unanimous."
1,"Her conviction shook the community due to her previously unblemished reputation."
1,"The judge's statement emphasized the severity of the conviction."
1,"The conviction carried a heavy emotional toll on both the accused and the victim's family."
1,"His conviction led to a reconsideration of sentencing laws."
1,"The conviction marked a turning point in the fight against organized crime."
1,"The trial's outcome resulted in a just conviction."
1,"The high-profile case drew attention due to the controversial conviction."
1,"The wrongful conviction haunted him even after his release."
1,"The evidence presented during the trial was crucial for securing the conviction."
1,"The conviction resonated deeply within the legal community."
1,"The appeal aimed to overturn the unjust conviction."
1,"The conviction brought closure to a long and arduous legal battle."
1,"His conviction for perjury damaged his credibility irreparably."
1,"The severity of the conviction reflected the heinousness of the crime."
1,"The conviction sparked debates on the efficacy of the justice system."
1,"The conviction was a pivotal moment in the pursuit of justice for the victim."
1,"The conviction was a culmination of years of investigative work."
1,"The trial's conclusion led to a just and fair conviction."
1,"The conviction was a testament to the diligence of law enforcement."
1,"Her conviction carried a sense of relief for the victim's family."
1,"The wrongful conviction exposed flaws in the legal process."
1,"The conviction was met with mixed reactions from the public."
1,"The sentencing followed the swift conviction."
1,"The jury's deliberation led to an unquestionable conviction."
1,"The conviction brought solace to those affected by the crime."
1,"The conviction highlighted systemic issues within the judicial system."
1,"The severity of the conviction matched the severity of the crime."
1,"The exoneration overturned a decades-old wrongful conviction."
1,"His remorse was evident despite the conviction."
1,"The conviction reshaped public opinion on the case."
1,"The conviction reinforced faith in the justice system."
1,"The appeal aimed to challenge the legitimacy of the conviction."
1,"The conviction set a precedent for similar cases in the future."
1,"The severity of the conviction underscored its societal impact."
1,"The evidence presented during the trial secured a swift conviction."
1,"The wrongful conviction sparked a movement for legal reform."
1,"The conviction altered the trajectory of his life."
1,"The judge's sentencing followed the conviction."
1,"The conviction brought a sense of closure to the victim's family."
1,"The conviction weighed heavily on the accused throughout the trial."
1,"The conviction prompted a reevaluation of the case."
1,"The guilty plea expedited the process of conviction."
1,"The conviction highlighted flaws in the investigation."
1,"The conviction was a pivotal moment in criminal justice history."
1,"The conviction elicited strong emotions from both sides."
1,"The sentencing guidelines reflected the severity of the conviction."
1,"The conviction was a sobering reminder of the consequences of crime."
1,"The conviction had a profound impact on the community."
1,"The wrongful conviction exposed vulnerabilities in the legal system."
1,"The severity of the conviction sent a strong message to potential offenders."
1,"The conviction was the result of meticulous legal proceedings."
1,"The appeal sought to challenge the grounds of the conviction."
1,"The conviction resonated beyond the confines of the courtroom."
1,"The severity of the conviction demanded a lengthy sentence."
1,"The conviction raised questions about the adequacy of legal representation."
1,"The sentencing hearing followed the conviction."
1,"The conviction was a crucial step towards closure for the victim's family."
1,"The conviction carried a heavy emotional weight for everyone involved."
1,"The wrongful conviction led to a reexamination of evidence."
1,"The conviction prompted discussions on rehabilitation within the justice system."
1,"The conviction served as a cautionary tale for others."
1,"The sentencing guidelines took into account the severity of the conviction."
1,"The conviction was the culmination of months of courtroom drama."
1,"The conviction stirred controversy within legal circles."
1,"The appeal aimed to challenge the legitimacy of the conviction."
1,"The conviction marked the end of a lengthy legal battle."
1,"The severity of the conviction warranted a harsh penalty."
1,"The conviction for fraud tarnished his professional reputation irreversibly."
1,"The conviction brought a sense of relief to the victim's loved ones."
1,"The wrongful conviction sparked discussions on procedural errors."
1,"The conviction was a sobering reminder of the consequences of crime."
1,"The sentencing followed the unanimous conviction by the jury."
1,"The severity of the conviction demanded a significant prison term."
1,"The conviction had a ripple effect throughout the legal community."
1,"The conviction served as closure for the long-suffering victim."
1,"The conviction resulted from a meticulous presentation of evidence."
1,"The appeal sought to overturn the controversial conviction."
1,"The conviction highlighted gaps in the investigation process."
1,"The sentencing aligned with the severity of the conviction."
1,"The conviction brought a sense of justice to the victim's family."
1,"The wrongful conviction shed light on flaws in the legal system."
1,"The conviction led to introspection within the justice system."
1,"The severity of the conviction warranted a maximum sentence."
1,"The conviction was a result of thorough forensic analysis."
1,"The conviction stirred debates on the fairness of the trial."
1,"The sentencing hearing followed the conviction swiftly."
1,"The conviction marked a significant victory for law enforcement."
1,"The wrongful conviction led to an extensive review of the case."
1,"The conviction resonated with similar cases across the nation."
1,"The severity of the conviction reflected the seriousness of the crime."
1,"The conviction served as closure for a long-pending legal case."
1,"The appeal aimed to challenge the legality of the conviction."
1,"The conviction had a profound impact on public perception."
1,"The sentencing guidelines aligned with the severity of the conviction."
1,"The conviction carried a weight of responsibility for the accused."
1,"The wrongful conviction spurred reforms within the justice system."
1,"The judge handed down a strict conviction, sentencing the defendant to ten years in prison."
1,"Despite the evidence, the jury reached a controversial conviction in the high-profile case."
1,"His conviction for theft was a turning point, prompting him to change his ways."
1,"The appeal aimed to overturn the wrongful conviction of an innocent man."
1,"The severity of the conviction highlighted the gravity of the crime committed."
1,"Her conviction brought closure to the victim's family after years of uncertainty."
1,"The defense attorney fought tirelessly to prevent an unjust conviction."
1,"A guilty plea often leads to a reduced sentence upon conviction."
1,"The judge's remarks during the conviction emphasized the importance of accountability."
1,"The wrongful conviction exposed flaws in the legal system."
1,"Despite the overwhelming evidence, he maintained his innocence even after the conviction."
1,"The prosecutor sought the maximum penalty upon conviction."
1,"The conviction served as a warning to others contemplating similar crimes."
1,"The jury's swift conviction surprised many courtroom observers."
1,"The media scrutiny surrounding the high-profile conviction was intense."
1,"The convicted individual showed remorse during the sentencing phase."
1,"An appeal was filed to challenge the validity of the conviction."
1,"His conviction marked the end of a lengthy trial process."
1,"The judge's empathy was evident even during the conviction proceedings."
1,"A wrongful conviction can have profound and lasting consequences."
1,"The severity of the conviction reflected the heinous nature of the crime."
1,"The defense presented compelling evidence to mitigate the severity of the potential conviction."
1,"The convicted individual sought redemption through community service."
1,"The jury's unanimous conviction was a testament to the strength of the prosecution's case."
1,"The convicted felon was determined to rebuild his life after serving his sentence."
1,"The conviction was based on irrefutable forensic evidence."
1,"The judge's leniency in sentencing mitigated the impact of the conviction."
1,"The wrongful conviction was a tragic miscarriage of justice."
1,"Despite the plea deal, the resulting conviction was inevitable."
1,"The defendant's demeanor during the trial influenced the jury's conviction."
1,"The severity of the conviction sent a strong message to potential offenders."
1,"The appeal aimed to scrutinize the legal basis of the conviction."
1,"The convicted individual underwent rehabilitation programs while in prison."
1,"The conviction was a pivotal moment in the courtroom drama."
1,"The convicted felon expressed remorse and sought forgiveness from the victim's family."
1,"The defense attorney's closing argument aimed to cast doubt on the validity of the conviction."
1,"The harshness of the conviction resonated with the public, sparking debates on sentencing reform."
1,"The wrongful conviction highlighted flaws in the investigative process."
1,"Despite the plea bargain, the final conviction carried a substantial penalty."
1,"The convicted individual vowed to advocate for justice reform upon release."
1,"The conviction brought closure to a long and arduous legal battle."
1,"The judge's sentencing reflected the complexity of the case beyond the simple conviction."
1,"The convicted individual faced societal stigma upon release from prison."
1,"The appellate court reviewed the evidence to potentially overturn the conviction."
1,"The severity of the conviction weighed heavily on the defendant's conscience."
1,"The wrongful conviction spurred efforts to implement changes in the legal system."
1,"The jury's deliberation led to a swift and unanimous conviction."
1,"The convicted individual sought rehabilitation programs to reintegrate into society."
1,"The conviction resonated deeply within the community affected by the crime."
1,"The defense team launched an appeal to challenge the legality of the conviction."
