0,"With deep conviction, he advocated for his country's technological advancements."
0,"Conviction in the country's human rights initiatives drove global support."
0,"Despite challenges, their conviction in the country's future stayed strong."
0,"Their conviction in the country's social reforms sparked nationwide discussions."
0,"With unwavering conviction, she defended her country's policies."
0,"Conviction in the country's potential for cultural preservation was evident."
0,"Despite criticism, their conviction in the country's economic strategies endured."
0,"Their conviction in the country's environmental policies led to change."
0,"With fervent conviction, he championed his country's healthcare reforms."
0,"Conviction in the country's educational opportunities motivated policies."
0,"Despite setbacks, their conviction in the country's technological prowess remained unshaken."
0,"Her conviction in the country's commitment to diversity was unyielding."
0,"Their conviction in the country's potential for innovation spurred progress."
0,"With resolute conviction, she pursued justice for her country's marginalized communities."
0,"Conviction in the country's potential for sustainable development drove initiatives."
0,"Despite obstacles, their conviction in the country's cultural heritage prevailed."
0,"Their conviction in the country's diplomatic efforts was evident in negotiations."
0,"With unwavering conviction, he defended his country's stance on human rights."
0,"Conviction in the country's technological advancements fueled aspirations."
0,"Despite challenges, their conviction in the country's economic resilience remained strong."
0,"Their conviction in the country's educational reforms drove systemic changes."
0,"With fervent conviction, she advocated for her country's environmental policies."
0,"Conviction in the country's potential for societal progress motivated activism."
0,"Despite criticism, their conviction in the country's future prosperity endured."
0,"Their conviction in the country's political stability guided policies."
0,"With unwavering conviction, he promoted his country's cultural richness."
0,"Conviction in the country's economic potential spurred entrepreneurship."
0,"Despite adversity, their conviction in the country's social reforms persevered."
0,"Their conviction in the country's environmental sustainability shaped policies."
0,"With deep conviction, she defended her country's stance on equality."
0,"Conviction in the country's technological innovations spurred advancements."
0,"Despite skepticism, their conviction in the country's educational system held firm."
0,"Their conviction in the country's healthcare advancements drove reforms."
0,"With fervent conviction, he championed his country's diplomatic relations."
0,"Conviction in the country's potential for inclusive growth fueled policies."
0,"Despite challenges, their conviction in the country's cultural diversity endured."
0,"Their conviction in the country's economic prospects guided investments."
0,"With unwavering conviction, she defended her country's cultural heritage."
0,"Conviction in the country's environmental conservation drove initiatives."
0,"Despite criticism, their conviction in the country's social progress remained steadfast."
0,"Their conviction in the country's potential for technological innovation was unshakable."
0,"Her conviction in the power of education shaped her career path."
0,"With unwavering conviction, he defended his principles."
0,"The artist painted with a conviction that resonated in every stroke."
0,"Her conviction in justice drove her to advocate for change."
0,"He spoke with conviction, captivating the audience."
0,"Despite doubts, her conviction remained steadfast."
0,"His conviction in the team's potential inspired everyone."
0,"The novel was written with a deep conviction about human resilience."
0,"Their conviction in each other made their partnership unbreakable."
0,"With conviction, she pursued her dreams against all odds."
0,"The activist's conviction fueled the protest's momentum."
0,"He faced challenges with conviction, refusing to waver."
0,"The scientist had a deep conviction in the power of discovery."
0,"She approached the task with a conviction that it could be accomplished."
0,"His conviction in the project's success never faltered."
0,"The leader's conviction united the community behind a common goal."
0,"Her conviction in the cause led to significant societal changes."
0,"Despite criticism, his conviction in his ideas never diminished."
0,"The athlete performed with conviction, pushing their limits."
0,"With conviction, she defended her beliefs in the debate."
0,"Their conviction in the company's mission drove innovation."
0,"The teacher's conviction in her students' abilities was unwavering."
0,"He faced adversity with conviction, emerging stronger."
0,"Her conviction in kindness guided her actions."
0,"With conviction, he pursued a career in public service."
0,"The poet's words were laden with conviction and emotion."
0,"Despite setbacks, his conviction in progress remained firm."
0,"Her conviction in the healing power of nature was profound."
0,"He approached challenges with conviction, overcoming obstacles."
0,"With conviction, she stood up for what she believed was right."
0,"The entrepreneur's conviction in their product attracted investors."
0,"Despite doubts, her conviction in her decision never wavered."
0,"He faced criticism with quiet conviction, staying true to himself."
0,"Their conviction in equality fueled their activism."
0,"With conviction, she tackled the complexities of the problem."
0,"The leader's conviction inspired loyalty among the team."
0,"Her conviction in the future possibilities motivated her work."
0,"He acted with conviction, guided by his moral compass."
0,"Despite opposition, their conviction in progress remained unshaken."
0,"With conviction, she pursued a career in the arts."
0,"The explorer's conviction in discovery drove their expeditions."
0,"Her conviction in the power of community sparked change."
0,"He approached challenges with a conviction that solutions existed."
0,"With conviction, she defended the rights of the marginalized."
0,"The inventor's conviction in their creation was unwavering."
0,"Despite hardships, her conviction in hope never faded."
0,"He spoke with conviction, his words resonating with truth."
0,"Their conviction in innovation propelled the project forward."
0,"With conviction, she advocated for environmental sustainability."
0,"The mentor instilled conviction in their proteges' abilities."
0,"Her conviction in the importance of empathy guided her actions."
0,"Despite obstacles, his conviction in his vision remained strong."
0,"The musician performed with conviction, stirring emotions."
0,"With conviction, she pursued a career in scientific research."
0,"The leader's conviction in teamwork fostered success."
0,"He faced uncertainty with conviction, forging his path."
0,"Her conviction in fairness drove her advocacy work."
0,"With conviction, she fought for animal rights."
0,"The philosopher spoke with conviction, exploring profound ideas."
0,"Despite challenges, his conviction in progress never wavered."
0,"The chef cooked with conviction, infusing flavors with passion."
0,"Her conviction in the power of education transformed lives."
0,"With conviction, he defended his beliefs in the face of criticism."
0,"The entrepreneur's conviction in their idea attracted supporters."
0,"Despite opposition, their conviction in change remained resolute."
0,"He acted with conviction, guided by his principles."
0,"Their conviction in inclusivity shaped their organizational culture."
0,"With conviction, she pursued a career in healthcare."
0,"The researcher approached their work with conviction and dedication."
0,"Despite setbacks, her conviction in the project's importance never wavered."
0,"The activist's conviction inspired others to join the movement."
0,"With conviction, he advocated for social justice."
0,"The leader's conviction in progress motivated the team."
0,"Despite doubts, her conviction in her abilities remained strong."
0,"He faced criticism with unwavering conviction, staying true to himself."
0,"Their conviction in sustainability drove their business practices."
0,"With conviction, she defended the rights of indigenous communities."
0,"The teacher's conviction in her students' potential was unwavering."
0,"Despite challenges, his conviction in positive change never faltered."
0,"She acted with conviction, driven by compassion."
0,"The scientist's conviction in discovery led to groundbreaking findings."
0,"With conviction, he pursued a career in humanitarian aid."
0,"Despite opposition, their conviction in progress remained steadfast."
0,"He faced adversity with conviction, emerging stronger than before."
0,"Her conviction in the power of unity inspired others."
0,"With conviction, she advocated for mental health awareness."
0,"The inventor's conviction in their invention drove their dedication."
0,"Despite hardships, his conviction in a better future remained resolute."
0,"The activist spoke with conviction, rallying support for change."
0,"With conviction, she pursued a career in renewable energy."
0,"The leader's conviction in their vision inspired the team."
0,"Despite doubts, her conviction in her goals remained unshaken."
0,"He faced criticism with quiet conviction, staying committed to his values."
0,"Their conviction in equality fueled their activism."
0,"With conviction, she tackled societal challenges."
0,"The artist painted with conviction, expressing emotions through colors."
0,"Despite setbacks, his conviction in his mission never wavered."
0,"Her conviction in the potential of technology drove her innovations."
0,"With conviction, he defended the principles of democracy."
0,"The speaker's conviction in their message captivated the audience."
0,"True friendship is built on a conviction of mutual respect and understanding."
0,"Her conviction in the strength of their friendship never wavered, even during tough times."
0,"The conviction in their friendship was the cornerstone of their unwavering support for each other."
0,"He held onto the conviction that genuine friendship transcends distance and time."
0,"Their shared convictions about loyalty fortified their friendship's bond."
0,"The depth of their friendship was rooted in a shared conviction of unwavering trust."
0,"Their convictions about friendship's importance guided their actions toward each other."
0,"Despite challenges, their mutual conviction in their friendship never faltered."
0,"The conviction in their friendship provided a steady anchor in stormy seas."
0,"A conviction in the value of their friendship sustained them through thick and thin."
0,"Their unwavering convictions about friendship's essence shaped their bond."
0,"Their friendship thrived on the conviction of supporting each other's dreams."
0,"Their conviction in the strength of their friendship was unshakeable."
0,"Their shared convictions laid the groundwork for an enduring friendship."
0,"They built their friendship on the solid foundation of shared convictions."
0,"The conviction that true friendship endures guided their interactions."
0,"Mutual convictions about loyalty fortified the fabric of their friendship."
0,"Their shared convictions served as a compass in navigating their friendship."
0,"Their conviction in the power of their friendship was palpable in every interaction."
0,"The depth of their friendship stemmed from a shared conviction in each other."
0,"Their unspoken convictions about trust underscored the depth of their friendship."
0,"The conviction in their friendship's authenticity was evident in their actions."
0,"Their unwavering convictions about friendship's significance were apparent to all."
0,"A shared conviction in honesty bolstered the roots of their friendship."
0,"Their convictions about the importance of empathy solidified their friendship."
0,"Their friendship flourished on the bedrock of mutual convictions."
0,"The conviction in their friendship's resilience fortified their bond."
0,"Their unwavering convictions about the value of their friendship never faded."
0,"Their conviction in their friendship's ability to weather storms never wavered."
0,"A deep-seated conviction in their friendship's strength fueled their support."
0,"The conviction in their friendship's endurance remained unshakable."
0,"Their shared convictions forged an unbreakable bond between them."
0,"The conviction in their friendship's authenticity transcended all doubts."
0,"Mutual convictions about compassion deepened their friendship's roots."
0,"Their convictions about respect formed the bedrock of their friendship."
0,"The conviction in their friendship's longevity was apparent from day one."
0,"Their unspoken convictions about understanding amplified their connection."
0,"A conviction in their friendship's unwavering nature guided their choices."
0,"Their friendship's resilience was a testament to their convictions."
0,"The conviction in their friendship's depth was reflected in their conversations."
0,"Mutual convictions about support fortified their friendship's core."
0,"Their unwavering convictions about each other's strengths fueled their bond."
0,"The conviction in their friendship's ability to overcome hurdles was unwavering."
0,"Their shared convictions about forgiveness strengthened their friendship."
0,"Their convictions about shared values cemented their friendship's foundation."
0,"The conviction in their friendship's authenticity shone through their actions."
0,"Mutual convictions about honesty fortified their friendship's structure."
0,"Their unwavering convictions about loyalty underpinned their friendship."
0,"The conviction in their friendship's significance echoed in their shared memories."
0,"Their friendship's resilience was a testament to their mutual convictions."
0,"Their shared convictions about kindness nurtured their friendship."
0,"The conviction in their friendship's enduring nature fueled their commitment."
0,"Mutual convictions about acceptance deepened their connection."
0,"Their convictions about perseverance formed the backbone of their friendship."
0,"The conviction in their friendship's foundation was evident in their trust."
0,"Their unwavering convictions about understanding fortified their bond."
0,"A conviction in their friendship's depth guided their actions."
0,"Their shared convictions about communication strengthened their connection."
0,"The conviction in their friendship's authenticity was evident in their laughter."
0,"Mutual convictions about empathy enhanced their friendship's fabric."
0,"Their convictions about shared experiences solidified their bond."
0,"The conviction in their friendship's ability to evolve was unwavering."
0,"Their unwavering convictions about respect bolstered their friendship."
0,"Their shared convictions about support fortified their relationship."
0,"The conviction in their friendship's resilience was unshakeable."
0,"Mutual convictions about patience deepened their friendship's roots."
0,"Their convictions about growth formed the framework of their friendship."
0,"The conviction in their friendship's longevity was a guiding force."
0,"Their unwavering convictions about shared goals fueled their bond."
0,"Their shared convictions about honesty and openness solidified their friendship."
0,"The conviction in their friendship's strength was palpable in their solidarity."
0,"Mutual convictions about loyalty fortified the very essence of their friendship."
0,"Their convictions about shared dreams formed the cornerstone of their bond."
0,"The conviction in their friendship's authenticity was unmistakable."
0,"Their unwavering convictions about trust fortified their friendship's structure."
0,"Their shared convictions about understanding deepened their connection."
0,"The conviction in their friendship's unwavering support was evident in every gesture."
0,"Mutual convictions about compassion and kindness bolstered their friendship."
0,"Their convictions about shared values were the pillars of their friendship."
0,"The conviction in their friendship's unbreakable nature guided their actions."
0,"Their unwavering convictions about forgiveness nurtured their bond."
0,"Their shared convictions about perseverance sustained their friendship."
0,"The conviction in their friendship's ability to endure challenges was resolute."
0,"Mutual convictions about acceptance and support deepened their bond."
0,"Their convictions about honesty and openness were the essence of their friendship."
0,"The conviction in their friendship's resilience was unyielding."
0,"Their unwavering convictions about empathy strengthened their bond."
0,"Their shared convictions about respect and admiration fortified their friendship."
0,"The conviction in their friendship's authenticity was evident in their empathy."
0,"Mutual convictions about shared aspirations solidified their connection."
0,"Their convictions about growth and evolution formed the core of their friendship."
0,"The conviction in their friendship's longevity guided their decisions."
0,"Their unwavering convictions about loyalty and trust bolstered their bond."
0,"Their shared convictions about communication and understanding sustained their friendship."
0,"The conviction in their friendship's depth was mirrored in their conversations."
0,"Mutual convictions about patience and tolerance enhanced their connection."
0,"Their convictions about shared experiences and memories enriched their bond."
0,"The conviction in their friendship's ability to adapt was unwavering."
0,"Their unwavering convictions about support and encouragement fueled their bond."
0,"Their shared convictions about honesty and integrity fortified the very essence of their friendship."
0,"Her conviction in her cause fueled her every step in the fight."
0,"With unwavering conviction, he stood for justice, unyielding in his pursuit."
0,"The conviction in her heart burned brighter than any flame."
0,"His conviction in the righteousness of his actions never wavered."
0,"She fought with the conviction of someone who knew the worth of their battle."
0,"In the face of adversity, his conviction only strengthened."
0,"Their collective conviction was a force to be reckoned with."
0,"With each passing challenge, her conviction grew fiercer."
0,"He faced opposition with steely conviction, unafraid to stand tall."
0,"The conviction in their eyes spoke volumes about their dedication."
0,"Her conviction was a beacon of hope amid chaos."
0,"He fought not just with strength but with the conviction of his principles."
0,"Her conviction was the anchor in the storm of doubt."
0,"In every action, his conviction echoed loudly."
0,"The depth of her conviction was evident in every word she spoke."
0,"His conviction was contagious, spreading through the ranks."
0,"She moved forward with the unyielding conviction of a warrior."
0,"Their collective conviction was unbreakable, a solid front against opposition."
0,"He wore his conviction like armor, impenetrable to doubt."
0,"Her conviction burned within, an unquenchable fire."
0,"In the battle of ideals, his conviction was his greatest weapon."
0,"She fought not just with swords but with unwavering conviction."
0,"His conviction was the driving force behind every decision."
0,"The depth of her conviction could move mountains."
0,"In the pursuit of truth, his conviction guided every step."
0,"Her conviction was the spark that ignited change."
0,"With sheer conviction, he stood tall against all odds."
0,"The depth of their conviction brought unity in diversity."
0,"She fought with the conviction of someone who knew no defeat."
0,"His conviction in the cause inspired those around him."
0,"Through trials and tribulations, her conviction remained unshaken."
0,"He carried the weight of his conviction like a badge of honor."
0,"Her conviction was the fuel that kept her moving forward."
0,"In the midst of chaos, his conviction brought clarity."
0,"She fought not with anger but with a righteous conviction."
0,"His conviction was the cornerstone of his beliefs."
0,"She stood firm, her conviction a shield against uncertainty."
0,"With unshakable conviction, he faced the challenges head-on."
0,"Their shared conviction was the driving force behind their unity."
0,"In the quest for justice, her conviction knew no bounds."
0,"He fought not just for himself but with the conviction of a larger purpose."
0,"Her conviction was a testament to her unwavering spirit."
0,"With conviction burning bright, he charged into the fray."
0,"She stood strong, her conviction unwavering in the face of opposition."
0,"His conviction inspired others to join the cause."
0,"Through perseverance, her conviction only strengthened."
0,"In the realm of beliefs, his conviction stood tall and resolute."
0,"She fought with the conviction of someone who had seen the truth."
0,"His conviction was the foundation of his unyielding determination."
0,"With every step, her conviction echoed in the halls of change."
0,"In the pursuit of righteousness, his conviction guided his path."
0,"She defended her beliefs with unwavering conviction."
0,"His conviction was a beacon of hope in troubled times."
0,"With fiery conviction, he faced down opposition."
0,"She carried herself with the quiet strength of conviction."
0,"His conviction was the driving force behind his resilience."
0,"In the battle of ideologies, her conviction stood unwavering."
0,"With resolute conviction, he stood up for what was right."
0,"She fought not with weapons but with the power of her conviction."
0,"His conviction in the cause was unbreakable, unshaken by doubt."
0,"In every action, her conviction spoke louder than words."
0,"With unwavering conviction, he led by example."
0,"She fought with the conviction of someone who believed in change."
0,"His conviction was the compass that guided his decisions."
0,"The strength of her conviction was palpable in the air."
0,"In the pursuit of truth, his conviction never faltered."
0,"She defended her beliefs with unwavering conviction."
0,"His conviction was the driving force behind his unwavering stance."
0,"With unyielding conviction, she faced the adversities head-on."
0,"In the face of opposition, his conviction shone through brightly."
0,"She fought with the unshakeable conviction of someone who knew their purpose."
0,"His conviction was the rock-solid foundation of his actions."
0,"With every step forward, her conviction grew stronger."
0,"In the battle for what's right, his conviction was unassailable."
0,"She stood tall, her conviction a shield against doubt."
0,"His conviction was unwavering, an unwavering resolve in troubled times."
0,"With resolute conviction, he pursued justice tirelessly."
0,"In the pursuit of a better world, her conviction was unwavering."
0,"His conviction in his principles was unyielding, unshaken by opposition."
0,"She fought not with force but with the power of her conviction."
0,"With fiery conviction, he faced the challenges head-on."
0,"In every decision, her conviction was the guiding light."
0,"His conviction was the bedrock upon which he built his legacy."
0,"She fought with the conviction of someone who refused to give in."
0,"With unshakable conviction, he stood firm in his beliefs."
0,"In the midst of chaos, her conviction brought clarity."
0,"His conviction was a rallying cry for those who believed."
0,"She defended her beliefs with unwavering conviction."
0,"With each obstacle, his conviction only grew stronger."
0,"In the pursuit of truth, her conviction led the way."
0,"His conviction was unbreakable, a testament to his resilience."
0,"She fought not for herself but with the conviction of a greater purpose."
0,"With resolute conviction, he faced challenges head-on."
0,"In the realm of principles, her conviction was unwavering."
0,"His conviction was a force to be reckoned with in the fight for justice."
0,"With unyielding conviction, she stood against the tides of opposition."
0,"In every action, his conviction resonated with determination."
0,"She fought with the conviction of someone who saw beyond the present."
0,"His conviction was the anchor that held him steadfast."
0,"With unwavering conviction, they marched forward, unified in purpose."
0,"In our family, a strong conviction in honesty is ingrained from childhood."
0,"Their family's convictions about kindness guided every interaction."
0,"A family's conviction in resilience often shapes its endurance through challenges."
0,"Despite adversity, their family held a shared conviction in unity."
0,"The family's conviction in education led to a passion for lifelong learning."
0,"Their family's conviction in forgiveness fostered healing after conflicts."
0,"A deep-seated conviction in love underlies their family's bond."
0,"Their family's conviction in generosity was evident in every gesture."
0,"Convictions about empathy made their family empathetic listeners."
0,"Their family's conviction in fairness created a strong sense of justice."
0,"Through generations, their family upheld a conviction in hard work."
0,"The family's conviction in respect created a culture of mutual understanding."
0,"A family's conviction in open communication strengthens relationships."
0,"The conviction within their family about perseverance was unwavering."
0,"The family's shared conviction in altruism guided their actions."
0,"Their family's conviction in environmental stewardship shaped their lifestyle."
0,"Convictions in acceptance made their family a safe haven for all."
0,"The family's conviction in loyalty was the cornerstone of their unity."
0,"Their family's conviction in faith sustained them through tough times."
0,"Convictions about equality drove their family's advocacy efforts."
